
饮食,饭店,松露鲜花餐厅    ,萧山区休博路第一世界大酒店旁边,http://360.duc.cn/pano/worksView?id=16936
饮食,咖啡店,摩登咖啡,萧山区休博路第一世界大酒店旁边,http://360.duc.cn/pano/worksView?id=16944
饮食,料理,野鹤居酒屋,萧山区休博路第一世界大酒店旁边,http://360.duc.cn/pano/worksView?id=16951
饮食,饭店,喵来了烤鱼馆,萧山区旺角城5幢301(三楼）,http://360.duc.cn/pano/worksView?id=17990
饮食,饭店,好得火锅,萧山区金城路399号,http://360.duc.cn/pano/worksView?id=17120
饮食,咖啡,漫花蒲咖啡时尚音乐餐厅,萧山区市心路123号旺角城金座1楼,http://360.duc.cn/pano/worksView?id=18760
饮食,饭店,致青春主题餐厅,萧山区金城路618号心意广场1号楼102,http://360.duc.cn/pano/worksView?id=17090
饮食,咖啡,夏洛克咖啡,萧山区山阴路1118号,http://360.duc.cn/pano/worksView?id=17078
住宿,酒店,杭州开瑞精品酒店,萧山区萧杭路508号,http://360.duc.cn/pano/worksView?id=23883
住宿,酒店,名景酒店,萧山区市心北路221号地铁2号线建设三路B出口,http://360.duc.cn/pano/worksView?id=24249
饮食,咖啡,哆朵咖啡屋,萧山区体育路259号,http://360.duc.cn/pano/worksView?id=23865
饮食,西餐,豪尚豪牛排（星光大道店）,滨江区星光广场中心必胜客楼上,http://360.duc.cn/pano/worksView?id=17319
饮食,饭店,春庄,滨江区丹枫路1075号星光广场雪峰银座一楼,http://360.duc.cn/pano/worksView?id=17291
住宿,酒店,欧诺臻品酒店,滨江区江晖路1757号中兴大厦5-7层,http://360.duc.cn/pano/worksView?id=18172
饮食,咖啡,泰晤士咖啡,滨江区江晖路1772号苏泊尔大厦二楼,http://360.duc.cn/pano/worksView?id=18907
休闲,KTV,东方纯K,滨江区江晖路1772号苏泊尔大厦二楼,http://360.duc.cn/pano/worksView?id=18870
饮食,饭店,玖舍印象煲莊,滨江区江晖路1930号东和时代大厦103号,http://360.duc.cn/pano/worksView?id=17318
饮食,咖啡,蜜菓咖啡,上城区庆春路227号,http://360.duc.cn/pano/worksView?id=18126
饮食,饭店,粤尚西湖海鲜大酒楼,下城区环城西路28号锦绣天地(温德姆大酒店二楼),http://360.duc.cn/pano/worksView?id=17866
饮食,饭店,蕞美餐厅,西湖区青芝坞8号,http://360.duc.cn/pano/worksView?id=17665
住宿,酒店,杭州遇见主题酒店,西湖区玉古路青芝坞2号.33号.34号,http://360.duc.cn/pano/worksView?id=24417
饮食,饭店,朴墅餐厅,西湖区玉古路61号青芝坞入口,http://360.duc.cn/pano/worksView?id=24267
住宿,青旅,杭州西游之家青年旅社,西湖区玉古路11号,http://360.duc.cn/pano/worksView?id=17600
饮食,西餐,九号,西湖区玉古路9号,http://360.duc.cn/pano/worksView?id=20943
住宿,民宿,春暖花开青年客栈,西湖区满觉龙路四眼井85号（近虎跑路）,http://360.duc.cn/pano/worksView?id=20927
住宿,青旅,灵芝家青年旅社,西湖区满觉龙路四眼井85号（近虎跑路）,http://360.duc.cn/pano/worksView?id=21003
饮食,咖啡,佐诺咖啡                    ,上城区长生路37-2,http://360.duc.cn/pano/worksView?id=18127
住宿,酒店,朴莲酒店,西湖区下满觉陇路198号,http://360.duc.cn/pano/worksView?id=19242
住宿,民宿,久栖客栈,西湖区下满觉陇192号,http://360.duc.cn/pano/worksView?id=19194
住宿,民宿,杭州麦浪主题民宿,西湖区下满觉陇188-1,http://360.duc.cn/pano/worksView?id=19270
住宿,民宿,寻慢,西湖区下满觉陇222号,http://360.duc.cn/pano/worksView?id=19269
住宿,民宿, 一色客栈,西湖区下满觉陇212号,http://360.duc.cn/pano/worksView?id=19050
饮食,饭店,味自满,西湖区下满觉陇32号,http://360.duc.cn/pano/worksView?id=21284
饮食,酒店,锦麟宾馆,下城区 凤起路435号,http://360.duc.cn/pano/worksView?id=18128
住宿,民宿,途画客栈,西湖区下满觉陇102号,http://360.duc.cn/pano/worksView?id=19732
住宿,酒店,这里艺术酒店,西湖区下满觉陇152号,http://360.duc.cn/pano/worksView?id=24536
饮食,咖啡,幻想咖啡,下城区武林路373号,http://360.duc.cn/pano/worksView?id=18252
饮食,咖啡,月泷轩,下城区武林路373号,http://360.duc.cn/pano/worksView?id=25316
饮食,饭店,香天下,上城区定安路27-6,http://360.duc.cn/pano/worksView?id=19317
饮食,咖啡,尚咖啡,上城区大井巷73号,http://360.duc.cn/pano/worksView?id=17711
饮食,饭店,漫私塾,上城区大井巷45号,http://360.duc.cn/pano/worksView?id=24083
饮食,西餐,印象湖畔,西湖区下满觉陇路82号,http://360.duc.cn/pano/worksView?id=19416
饮食,咖啡,p2p链友咖啡,杭州西湖区下城区体育场路342-2号,http://360.duc.cn/pano/worksView?id=18015
住宿,酒店,杭州市鑫概念酒店,西湖区体育场路365号,http://360.duc.cn/pano/worksView?id=19651
饮食,西餐,Mr.KING?,西湖区密度桥路17、19号新世纪大厦1f,http://360.duc.cn/pano/worksView?id=18268
住宿,民宿,卧云客栈,西湖区灵隐路白乐桥131号,http://360.duc.cn/pano/worksView?id=18520
住宿,民宿,水墨居小雅,西湖区灵隐路白乐桥246号,http://360.duc.cn/pano/worksView?id=23334
住宿,民宿,梵云,西湖区灵隐路白乐桥133号,http://360.duc.cn/pano/worksView?id=18450
住宿,民宿,栖木客栈 ,西湖区灵隐路白乐桥248号,http://360.duc.cn/pano/worksView?id=19663
住宿,民宿,晶晶的小窝,西湖区灵隐路白乐桥276号,http://360.duc.cn/pano/worksView?id=18536
住宿,民宿,樱桃小院,西湖区灵隐路白乐桥282号,http://360.duc.cn/pano/worksView?id=18460
住宿,民宿,眷舍,西湖区灵隐路白乐桥292号,http://360.duc.cn/pano/worksView?id=19114
住宿,酒店,皇后公园精品酒店,下城区武林路277号4楼,http://360.duc.cn/pano/worksView?id=19309
饮食,西餐,捷克比尔森音乐西餐厅,上城区南山路147号西湖天地9a9c号楼,http://360.duc.cn/pano/worksView?id=18408
饮食,咖啡,太古咖啡馆,上城区南山路184—1号,http://360.duc.cn/pano/worksView?id=18433
住宿,民宿,萱蓝小筑,西湖区龙井路茅家埠170号,http://360.duc.cn/pano/worksView?id=18962
饮食,西餐,威廉的太妃糖公馆,西湖区上茅家埠180号（西湖街道卫生服务中心旁）,http://360.duc.cn/pano/worksView?id=22654
饮食,饭店,五峰草堂,西湖区龙井路70号（茅家埠）,http://360.duc.cn/pano/worksView?id=18935
住宿,民宿,若隐,西湖区下满觉陇路105号,http://360.duc.cn/pano/worksView?id=22926
饮食,饭店,香衢园（教工路店）,西湖区教工路1号,http://360.duc.cn/pano/worksView?id=19505
休闲,温泉,信义坊温泉（精品主题客房）,拱墅区莫干山路328号,http://360.duc.cn/pano/worksView?id=18739
饮食,酒店,书香世家酒店,拱墅区莫干路246号,http://360.duc.cn/pano/worksView?id=18740
饮食,酒店,诗铂睿酒店,下城区延安路352号,http://360.duc.cn/pano/worksView?id=18692
住宿,民宿,紫涵小舍,西湖区下满觉陇路190号,http://360.duc.cn/pano/worksView?id=19511
饮食,酒吧,没有之一（魔朵酒吧）,下城区武林路277号皇后公园7～8楼,http://360.duc.cn/pano/worksView?id=18778
饮食,酒吧,大隐咖啡酒吧,西湖区益乐路64号,http://360.duc.cn/pano/worksView?id=18830
饮食,饭店,海角柒号（万泰城店）,上城区望江东路332中豪望江国际裙楼（万泰城）2楼203,http://360.duc.cn/pano/worksView?id=23060
饮食,饭店,海角柒号（益乐店）,西湖区益乐路39号,http://360.duc.cn/pano/worksView?id=18843
饮食,西餐,动物园西餐厅,西湖区文一路294号1楼zoo coffee,http://360.duc.cn/pano/worksView?id=19540
住宿,酒店,福朋喜来登国际大酒店,滨江区滨江区东信大道868号福朋喜来登酒店,http://360.duc.cn/pano/worksView?id=21090
饮食,茶馆,西溪庄园,西湖区西溪国家湿地公园北门,http://360.duc.cn/pano/worksView?id=24704
饮食,咖啡,魔克咖啡,西湖区西溪天堂商业街7-L101,http://360.duc.cn/pano/worksView?id=19965
饮食,西餐,塞纳河主题餐厅,江干区下沙宝龙城市广场澳门街6号楼,http://360.duc.cn/pano/worksView?id=22188
住宿,民宿,茶探客栈,西湖区满觉陇路杨家山5号,http://360.duc.cn/pano/worksView?id=21307
住宿,酒店,杭州玉榕西庐精品度假酒店,西湖区龙井路下茅家埠1号，近梅灵北路,http://360.duc.cn/pano/worksView?id=22874
住宿,酒店,杭州湘湖驿站度假酒店,萧山区湘湖路337号,http://360.duc.cn/pano/worksView?id=22359
住宿,民宿,曼陀罗,西湖区灵隐路白乐桥281号,http://360.duc.cn/pano/worksView?id=23332
饮食,饭店,31间（金桃餐厅）,西湖区留和路139号东信和创园31幢,http://360.duc.cn/pano/worksView?id=20427
住宿,酒店,31间（虚谷酒店）,西湖区留和路139号东信和创园31幢,http://360.duc.cn/pano/worksView?id=20445
饮食,西餐,没有之一（新杭州味）,西湖区 教工路26号世贸丽晶城欧美中心2号楼G区2层G110,http://360.duc.cn/pano/worksView?id=18744
饮食,料理,一凛日式料理餐厅,下城区香积寺路21号,http://360.duc.cn/pano/worksView?id=21855
饮食,酒吧,三么地西湖餐厅酒吧,下城区环城西路2号望湖宾馆1楼,http://360.duc.cn/pano/worksView?id=19715
饮食,料理,觅喜融合料理,西湖区古墩路97号,http://360.duc.cn/pano/worksView?id=20097
饮食,酒吧,雅觅餐厅酒吧,上城区环城东路23-1,http://360.duc.cn/pano/worksView?id=19709
饮食,饭店,花季餐厅,拱墅区上塘路458号水晶城购物中心5楼,http://360.duc.cn/pano/worksView?id=21743
休闲,养生,爱情故事（解放路店）,上城区解放路226号爱情故事,http://360.duc.cn/pano/worksView?id=22974
休闲,养生,爱情故事（庆春路店）,下城区庆春路48号五洋宾馆5楼,http://360.duc.cn/pano/worksView?id=23032
休闲,养生,爱情故事（体育路店）,下城区体育场路12号,http://360.duc.cn/pano/worksView?id=19898
休闲,养生,爱情故事（ 武林路店2）,下城区武林路50号,http://360.duc.cn/pano/worksView?id=21184
休闲,养生,爱情故事（ 武林路店1）,下城区武林路50号,http://360.duc.cn/pano/worksView?id=20747
休闲,养生,江南玉璞spa,滨江区江陵路2028号星耀城3幢4楼(武警医院斜对面),http://360.duc.cn/pano/worksView?id=21764
饮食,西餐,the frypan韩国炸鸡啤酒（西湖店）,下城区西湖文化广场莱迪美食广场b1fc_40,http://360.duc.cn/pano/worksView?id=22071
休闲,SPA, 杭州纽斯洗浴spa ,拱墅区莫干山路841弄128号(物美超市西行200米处),http://360.duc.cn/pano/worksView?id=23282
休闲,SPA,喜莲福健康管理spa ,西湖区文二西路706号五洋翡丽酒店4-5楼(名人名家楼上),http://360.duc.cn/pano/worksView?id=20909
住宿,酒店,浙江三立开元名都大酒店,下城区绍兴路538号浙江三立开元名都大酒店1楼(城北体育公园、京杭大运河),http://360.duc.cn/pano/worksView?id=19825
饮食,饭店,臻货餐厅（湖滨店）,上城区白傅路5号凯越酒店北侧,http://360.duc.cn/pano/worksView?id=20817
饮食,饭店,臻货餐厅（滨江店）,滨江区安业路251号江锦国际大厦4楼,http://360.duc.cn/pano/worksView?id=23422
饮食,西餐,MUSEK城市客厅, 上城区 学士路48号(东坡路),http://360.duc.cn/pano/worksView?id=20689
饮食,西餐,天伦里餐厅,西湖区西溪路550号 ,http://360.duc.cn/pano/worksView?id=21997
饮食,饭店,浙里餐厅,西湖区三台山路与虎跑路交叉口（赤山埠停车场内）,http://360.duc.cn/pano/worksView?id=21277
休闲,KTV,MAGO－KTV,下城区环城西路30号锦绣天地商务中心B1层（温德姆B1）,http://360.duc.cn/pano/worksView?id=24594
饮食,饭店,杭州酒家（延安路店）,上城区延安路205号1~3楼（延安路邮电路口）,http://360.duc.cn/pano/worksView?id=23615
饮食,饭店,汝拉小镇(天堂店),西湖区紫金港路21号西溪天堂商业街内（近西溪湿地博物馆）,http://360.duc.cn/pano/worksView?id=21987
